{
    "title": "SELECT uuid FROM coursesSingleEntry",
    "queryString": "In courses dataset coursesSingleEntry, find all entries; show UUID.",
    "response": {
        "code": 200,
        "body": { "result": [{ "coursesSingleEntry_uuid": "17255" }] }
    },
    "queryAST": {
        "ID": "coursesSingleEntry",
        "KIND": "courses",
        "WHERE": {},
        "OPTIONS": { "COLUMNS": ["coursesSingleEntry_uuid"] }
    }
}
