{
    "title": "SELECT href FROM roomsSingleRoom",
    "queryString": "In rooms dataset roomsSingleRoom, find all entries; show Link.",
    "response": {
        "code": 200,
        "body": {
            "result": [
                {
                    "roomsSingleRoom_href": "http://students.ubc.ca/campus/discover/buildings-and-classrooms/room/AERL-120"
                }
            ]
        }
    },
    "queryAST": {
        "ID": "roomsSingleRoom",
        "KIND": "rooms",
        "WHERE": {},
        "OPTIONS": { "COLUMNS": ["roomsSingleRoom_href"] }
    }
}
