{
    "title": "SELECT furniture FROM roomsSingleRoom",
    "queryString": "In rooms dataset roomsSingleRoom, find all entries; show Furniture.",
    "response": {
        "code": 200,
        "body": {
            "result": [
                { "roomsSingleRoom_furniture": "Classroom-Fixed Tablets" }
            ]
        }
    },
    "queryAST": {
        "ID": "roomsSingleRoom",
        "KIND": "rooms",
        "WHERE": {},
        "OPTIONS": { "COLUMNS": ["roomsSingleRoom_furniture"] }
    }
}
