{
    "title": "SELECT * FROM roomsTwoRooms ORDER BY seats DESC",
    "queryString": "In rooms dataset roomsTwoRooms, find all entries; show Full Name, Short Name, Number, Name, Address, Type, Furniture, Link, Latitude, Longitude and Seats; sort in descending order by Type.",
    "response": {
        "code": 200,
        "body": {
            "result": [
                {
                    "roomsTwoRooms_fullname": "Aquatic Ecosystems Research Laboratory",
                    "roomsTwoRooms_shortname": "AERL",
                    "roomsTwoRooms_number": "120",
                    "roomsTwoRooms_name": "AERL_120",
                    "roomsTwoRooms_address": "2202 Main Mall",
                    "roomsTwoRooms_lat": 49.26372,
                    "roomsTwoRooms_lon": -123.25099,
                    "roomsTwoRooms_seats": 144,
                    "roomsTwoRooms_type": "Tiered Large Group",
                    "roomsTwoRooms_furniture": "Classroom-Fixed Tablets",
                    "roomsTwoRooms_href": "http://students.ubc.ca/campus/discover/buildings-and-classrooms/room/AERL-120"
                },
                {
                    "roomsTwoRooms_fullname": "Allard Hall (LAW)",
                    "roomsTwoRooms_shortname": "ALRD",
                    "roomsTwoRooms_number": "105",
                    "roomsTwoRooms_name": "ALRD_105",
                    "roomsTwoRooms_address": "1822 East Mall",
                    "roomsTwoRooms_lat": 49.2699,
                    "roomsTwoRooms_lon": -123.25318,
                    "roomsTwoRooms_seats": 94,
                    "roomsTwoRooms_type": "Case Style",
                    "roomsTwoRooms_furniture": "Classroom-Fixed Tables/Movable Chairs",
                    "roomsTwoRooms_href": "http://students.ubc.ca/campus/discover/buildings-and-classrooms/room/ALRD-105"
                }
            ]
        }
    },
    "queryAST": {
        "ID": "roomsTwoRooms",
        "KIND": "rooms",
        "WHERE": {},
        "OPTIONS": {
            "COLUMNS": [
                "roomsTwoRooms_fullname",
                "roomsTwoRooms_shortname",
                "roomsTwoRooms_number",
                "roomsTwoRooms_name",
                "roomsTwoRooms_address",
                "roomsTwoRooms_type",
                "roomsTwoRooms_furniture",
                "roomsTwoRooms_href",
                "roomsTwoRooms_lat",
                "roomsTwoRooms_lon",
                "roomsTwoRooms_seats"
            ],
            "ORDER": { "dir": "DOWN", "keys": ["roomsTwoRooms_type"] }
        }
    }
}
