{
    "title": "SELECT dept, avg WHERE avg > 97",
    "queryString": "In courses dataset courseslarge, find entries whose Average is greater than 97; show Department and Average; sort in ascending order by Average.",
    "response": {
        "code": 200,
        "body": {
            "result": [
                { "courseslarge_dept": "math", "courseslarge_avg": 97.09 },
                { "courseslarge_dept": "math", "courseslarge_avg": 97.09 },
                { "courseslarge_dept": "epse", "courseslarge_avg": 97.09 },
                { "courseslarge_dept": "epse", "courseslarge_avg": 97.09 },
                { "courseslarge_dept": "math", "courseslarge_avg": 97.25 },
                { "courseslarge_dept": "math", "courseslarge_avg": 97.25 },
                { "courseslarge_dept": "epse", "courseslarge_avg": 97.29 },
                { "courseslarge_dept": "epse", "courseslarge_avg": 97.29 },
                { "courseslarge_dept": "nurs", "courseslarge_avg": 97.33 },
                { "courseslarge_dept": "nurs", "courseslarge_avg": 97.33 },
                { "courseslarge_dept": "epse", "courseslarge_avg": 97.41 },
                { "courseslarge_dept": "epse", "courseslarge_avg": 97.41 },
                { "courseslarge_dept": "cnps", "courseslarge_avg": 97.47 },
                { "courseslarge_dept": "cnps", "courseslarge_avg": 97.47 },
                { "courseslarge_dept": "math", "courseslarge_avg": 97.48 },
                { "courseslarge_dept": "math", "courseslarge_avg": 97.48 },
                { "courseslarge_dept": "educ", "courseslarge_avg": 97.5 },
                { "courseslarge_dept": "nurs", "courseslarge_avg": 97.53 },
                { "courseslarge_dept": "nurs", "courseslarge_avg": 97.53 },
                { "courseslarge_dept": "epse", "courseslarge_avg": 97.67 },
                { "courseslarge_dept": "epse", "courseslarge_avg": 97.69 },
                { "courseslarge_dept": "epse", "courseslarge_avg": 97.78 },
                { "courseslarge_dept": "crwr", "courseslarge_avg": 98 },
                { "courseslarge_dept": "crwr", "courseslarge_avg": 98 },
                { "courseslarge_dept": "epse", "courseslarge_avg": 98.08 },
                { "courseslarge_dept": "nurs", "courseslarge_avg": 98.21 },
                { "courseslarge_dept": "nurs", "courseslarge_avg": 98.21 },
                { "courseslarge_dept": "epse", "courseslarge_avg": 98.36 },
                { "courseslarge_dept": "epse", "courseslarge_avg": 98.45 },
                { "courseslarge_dept": "epse", "courseslarge_avg": 98.45 },
                { "courseslarge_dept": "nurs", "courseslarge_avg": 98.5 },
                { "courseslarge_dept": "nurs", "courseslarge_avg": 98.5 },
                { "courseslarge_dept": "nurs", "courseslarge_avg": 98.58 },
                { "courseslarge_dept": "nurs", "courseslarge_avg": 98.58 },
                { "courseslarge_dept": "epse", "courseslarge_avg": 98.58 },
                { "courseslarge_dept": "epse", "courseslarge_avg": 98.58 },
                { "courseslarge_dept": "epse", "courseslarge_avg": 98.7 },
                { "courseslarge_dept": "nurs", "courseslarge_avg": 98.71 },
                { "courseslarge_dept": "nurs", "courseslarge_avg": 98.71 },
                { "courseslarge_dept": "eece", "courseslarge_avg": 98.75 },
                { "courseslarge_dept": "eece", "courseslarge_avg": 98.75 },
                { "courseslarge_dept": "epse", "courseslarge_avg": 98.76 },
                { "courseslarge_dept": "epse", "courseslarge_avg": 98.76 },
                { "courseslarge_dept": "epse", "courseslarge_avg": 98.8 },
                { "courseslarge_dept": "spph", "courseslarge_avg": 98.98 },
                { "courseslarge_dept": "spph", "courseslarge_avg": 98.98 },
                { "courseslarge_dept": "cnps", "courseslarge_avg": 99.19 },
                { "courseslarge_dept": "math", "courseslarge_avg": 99.78 },
                { "courseslarge_dept": "math", "courseslarge_avg": 99.78 }
            ]
        }
    },
    "queryAST": {
        "ID": "courseslarge",
        "KIND": "courses",
        "WHERE": { "GT": { "courseslarge_avg": 97 } },
        "OPTIONS": {
            "COLUMNS": ["courseslarge_dept", "courseslarge_avg"],
            "ORDER": { "dir": "UP", "keys": ["courseslarge_avg"] }
        }
    }
}
