{
    "title": "SELECT * FROM coursesSingleEntry",
    "queryString": "In courses dataset coursesSingleEntry, find all entries; show Year.",
    "response": {
        "code": 200,
        "body": { "result": [{ "coursesSingleEntry_year": 2010 }] }
    },
    "queryAST": {
        "ID": "coursesSingleEntry",
        "KIND": "courses",
        "WHERE": {},
        "OPTIONS": { "COLUMNS": ["coursesSingleEntry_year"] }
    }
}
