{
    "title": "SELECT * FROM coursesTwoEntries, WHERE instructor NOT LIKE '%dave%', ORDER BY id ASC",
    "queryString": "In courses dataset coursesTwoEntries, find entries whose Instructor does not include \"dave\"; show Audit, Average, Department, Fail, ID, Instructor, Pass, Title and UUID; sort in ascending order by ID.",
    "response": {
        "code": 200,
        "body": {
            "result": [
                {
                    "coursesTwoEntries_audit": 10,
                    "coursesTwoEntries_avg": 80.13,
                    "coursesTwoEntries_dept": "phar",
                    "coursesTwoEntries_fail": 25,
                    "coursesTwoEntries_id": "454",
                    "coursesTwoEntries_instructor": "carr, roxane",
                    "coursesTwoEntries_pass": 221,
                    "coursesTwoEntries_title": "ped geri drg thp",
                    "coursesTwoEntries_uuid": "83080"
                }
            ]
        }
    },
    "queryAST": {
        "ID": "coursesTwoEntries",
        "KIND": "courses",
        "WHERE": {
            "NOT": { "INC": { "coursesTwoEntries_instructor": "dave" } }
        },
        "OPTIONS": {
            "COLUMNS": [
                "coursesTwoEntries_audit",
                "coursesTwoEntries_avg",
                "coursesTwoEntries_dept",
                "coursesTwoEntries_fail",
                "coursesTwoEntries_id",
                "coursesTwoEntries_instructor",
                "coursesTwoEntries_pass",
                "coursesTwoEntries_title",
                "coursesTwoEntries_uuid"
            ],
            "ORDER": { "dir": "UP", "keys": ["coursesTwoEntries_id"] }
        }
    }
}
