{
    "title": "S dept,title,AVG(avg),SUM(pass) F courses W title='*biol*' GB dept,title OB sumPass,avgGrade DESC",
    "queryString": "In courses dataset courses grouped by Department and Title, find entries whose Title includes \"biol\"; show Department, Title, avgGrade and sumPass, where avgGrade is the AVG of Average and sumPass is the SUM of Pass; sort in descending order by sumPass and avgGrade.",
    "response": {
        "code": 200,
        "body": {
            "result": [
                {
                    "courses_dept": "biol",
                    "courses_title": "biology of cell",
                    "avgGrade": 74.54,
                    "sumPass": 16482
                },
                {
                    "courses_dept": "biol",
                    "courses_title": "cell biology 1",
                    "avgGrade": 65.06,
                    "sumPass": 6820
                },
                {
                    "courses_dept": "biol",
                    "courses_title": "cell biology 2",
                    "avgGrade": 73.66,
                    "sumPass": 5450
                },
                {
                    "courses_dept": "micb",
                    "courses_title": "int env micrbiol",
                    "avgGrade": 69.74,
                    "sumPass": 5312
                },
                {
                    "courses_dept": "biol",
                    "courses_title": "human biology",
                    "avgGrade": 72.94,
                    "sumPass": 3998
                },
                {
                    "courses_dept": "biol",
                    "courses_title": "biol bact cell",
                    "avgGrade": 68.75,
                    "sumPass": 3014
                },
                {
                    "courses_dept": "biol",
                    "courses_title": "devlpmt neurbiol",
                    "avgGrade": 79.8,
                    "sumPass": 2018
                },
                {
                    "courses_dept": "biol",
                    "courses_title": "comp neurobiolgy",
                    "avgGrade": 76.14,
                    "sumPass": 1818
                },
                {
                    "courses_dept": "biol",
                    "courses_title": "developmtal biol",
                    "avgGrade": 76.22,
                    "sumPass": 1500
                },
                {
                    "courses_dept": "biol",
                    "courses_title": "pr conservt biol",
                    "avgGrade": 77.98,
                    "sumPass": 786
                },
                {
                    "courses_dept": "medg",
                    "courses_title": "gn&cl biol cancr",
                    "avgGrade": 82.19,
                    "sumPass": 570
                },
                {
                    "courses_dept": "medi",
                    "courses_title": "mole & cell biol",
                    "avgGrade": 86.78,
                    "sumPass": 566
                },
                {
                    "courses_dept": "biol",
                    "courses_title": "anim cell biol",
                    "avgGrade": 80.1,
                    "sumPass": 542
                },
                {
                    "courses_dept": "biol",
                    "courses_title": "adv cell biology",
                    "avgGrade": 83.04,
                    "sumPass": 438
                },
                {
                    "courses_dept": "eosc",
                    "courses_title": "mrne microbiolgy",
                    "avgGrade": 75.1,
                    "sumPass": 422
                },
                {
                    "courses_dept": "cons",
                    "courses_title": "conservat'n biol",
                    "avgGrade": 73.63,
                    "sumPass": 356
                },
                {
                    "courses_dept": "eosc",
                    "courses_title": "biolgl oceangrhy",
                    "avgGrade": 75.05,
                    "sumPass": 338
                },
                {
                    "courses_dept": "micb",
                    "courses_title": "intro microbiol",
                    "avgGrade": 68.24,
                    "sumPass": 322
                },
                {
                    "courses_dept": "biol",
                    "courses_title": "biology research",
                    "avgGrade": 90.46,
                    "sumPass": 317
                },
                {
                    "courses_dept": "medg",
                    "courses_title": "biolgy of cancer",
                    "avgGrade": 88.48,
                    "sumPass": 304
                },
                {
                    "courses_dept": "path",
                    "courses_title": "tech mlc biol&ex",
                    "avgGrade": 89.53,
                    "sumPass": 302
                },
                {
                    "courses_dept": "biol",
                    "courses_title": "biol of the cell",
                    "avgGrade": 86.84,
                    "sumPass": 302
                },
                {
                    "courses_dept": "dhyg",
                    "courses_title": "oral microbiolog",
                    "avgGrade": 81.05,
                    "sumPass": 215
                },
                {
                    "courses_dept": "phil",
                    "courses_title": "phil of biol",
                    "avgGrade": 77.53,
                    "sumPass": 212
                },
                {
                    "courses_dept": "biol",
                    "courses_title": "hist&phil biol",
                    "avgGrade": 77.25,
                    "sumPass": 196
                },
                {
                    "courses_dept": "civl",
                    "courses_title": "biol wstwtr trt",
                    "avgGrade": 80.64,
                    "sumPass": 152
                },
                {
                    "courses_dept": "obst",
                    "courses_title": "sem reprd biol",
                    "avgGrade": 87.72,
                    "sumPass": 116
                },
                {
                    "courses_dept": "biol",
                    "courses_title": "evo cell biology",
                    "avgGrade": 83.25,
                    "sumPass": 112
                },
                {
                    "courses_dept": "cell",
                    "courses_title": "tpcs dev biol",
                    "avgGrade": 88.13,
                    "sumPass": 94
                },
                {
                    "courses_dept": "biol",
                    "courses_title": "biol invertebrat",
                    "avgGrade": 78.69,
                    "sumPass": 90
                },
                {
                    "courses_dept": "biof",
                    "courses_title": "stat hi dim biol",
                    "avgGrade": 88.5,
                    "sumPass": 70
                },
                {
                    "courses_dept": "chbe",
                    "courses_title": "biolog eng lab",
                    "avgGrade": 79.03,
                    "sumPass": 64
                },
                {
                    "courses_dept": "frst",
                    "courses_title": "soil biology",
                    "avgGrade": 79.36,
                    "sumPass": 62
                },
                {
                    "courses_dept": "educ",
                    "courses_title": "teaching biology",
                    "avgGrade": 69.97,
                    "sumPass": 60
                },
                {
                    "courses_dept": "elec",
                    "courses_title": "biological mems",
                    "avgGrade": 73.11,
                    "sumPass": 56
                },
                {
                    "courses_dept": "chbe",
                    "courses_title": "biological eng",
                    "avgGrade": 82.57,
                    "sumPass": 54
                },
                {
                    "courses_dept": "cell",
                    "courses_title": "cell system biol",
                    "avgGrade": 86.93,
                    "sumPass": 50
                },
                {
                    "courses_dept": "biol",
                    "courses_title": "cell biol intrfk",
                    "avgGrade": 86.28,
                    "sumPass": 36
                },
                {
                    "courses_dept": "eosc",
                    "courses_title": "biol ocean sem",
                    "avgGrade": 88,
                    "sumPass": 16
                },
                {
                    "courses_dept": "path",
                    "courses_title": "biolgy of cancer",
                    "avgGrade": 87.67,
                    "sumPass": 14
                },
                {
                    "courses_dept": "frst",
                    "courses_title": "plnt molec biol",
                    "avgGrade": 90,
                    "sumPass": 8
                }
            ]
        }
    },
    "queryAST": {
        "ID": "courses",
        "KIND": "courses",
        "WHERE": { "INC": { "courses_title": "biol" } },
        "OPTIONS": {
            "COLUMNS": ["courses_dept", "courses_title", "avgGrade", "sumPass"],
            "ORDER": { "dir": "DOWN", "keys": ["sumPass", "avgGrade"] }
        },
        "TRANSFORMATIONS": {
            "GROUP": ["courses_dept", "courses_title"],
            "APPLY": [
                { "avgGrade": { "AVG": "courses_avg" } },
                { "sumPass": { "SUM": "courses_pass" } }
            ]
        }
    }
}
