{
    "title": "SELECT * FROM coursesTwoEntries, WHERE instructor LIKE '%dave%', ORDER BY id ASC",
    "queryString": "In courses dataset coursesTwoEntries, find entries whose Instructor includes \"dave\"; show Audit, Average, Department, Fail, ID, Instructor, Pass, Title and UUID; sort in ascending order by ID.",
    "response": {
        "code": 200,
        "body": {
            "result": [
                {
                    "coursesTwoEntries_audit": 0,
                    "coursesTwoEntries_avg": 86.65,
                    "coursesTwoEntries_dept": "adhe",
                    "coursesTwoEntries_fail": 0,
                    "coursesTwoEntries_id": "327",
                    "coursesTwoEntries_instructor": "smulders, dave",
                    "coursesTwoEntries_pass": 23,
                    "coursesTwoEntries_title": "teach adult",
                    "coursesTwoEntries_uuid": "17255"
                }
            ]
        }
    },
    "queryAST": {
        "ID": "coursesTwoEntries",
        "KIND": "courses",
        "WHERE": { "INC": { "coursesTwoEntries_instructor": "dave" } },
        "OPTIONS": {
            "COLUMNS": [
                "coursesTwoEntries_audit",
                "coursesTwoEntries_avg",
                "coursesTwoEntries_dept",
                "coursesTwoEntries_fail",
                "coursesTwoEntries_id",
                "coursesTwoEntries_instructor",
                "coursesTwoEntries_pass",
                "coursesTwoEntries_title",
                "coursesTwoEntries_uuid"
            ],
            "ORDER": { "dir": "UP", "keys": ["coursesTwoEntries_id"] }
        }
    }
}
