{
    "title": "SELECT dept, AVG(avg) FROM coursesFourEntries GROUP BY dept",
    "queryString": "In courses dataset coursesFourEntries grouped by Department, find all entries; show Department and avgGrade, where avgGrade is the AVG of Average.",
    "response": {
        "code": 200,
        "body": {
            "result": [
                { "coursesFourEntries_dept": "adhe", "avgGrade": 82.79 },
                { "coursesFourEntries_dept": "phar", "avgGrade": 77.72 }
            ]
        }
    },
    "queryAST": {
        "ID": "coursesFourEntries",
        "KIND": "courses",
        "WHERE": {},
        "OPTIONS": { "COLUMNS": ["coursesFourEntries_dept", "avgGrade"] },
        "TRANSFORMATIONS": {
            "GROUP": ["coursesFourEntries_dept"],
            "APPLY": [{ "avgGrade": { "AVG": "coursesFourEntries_avg" } }]
        }
    }
}
