{
    "title": "SELECT dept, MAX(pass) FROM coursesFourEntries GROUP BY dept",
    "queryString": "In courses dataset coursesFourEntries grouped by Department, find all entries; show Department and maxPass, where maxPass is the MAX of Pass.",
    "response": {
        "code": 200,
        "body": {
            "result": [
                { "coursesFourEntries_dept": "adhe", "maxPass": 42 },
                { "coursesFourEntries_dept": "phar", "maxPass": 221 }
            ]
        }
    },
    "queryAST": {
        "ID": "coursesFourEntries",
        "KIND": "courses",
        "WHERE": {},
        "OPTIONS": { "COLUMNS": ["coursesFourEntries_dept", "maxPass"] },
        "TRANSFORMATIONS": {
            "GROUP": ["coursesFourEntries_dept"],
            "APPLY": [{ "maxPass": { "MAX": "coursesFourEntries_pass" } }]
        }
    }
}
