{
    "title": "SELECT title FROM coursesSingleEntry",
    "queryString": "In courses dataset coursesSingleEntry, find all entries; show Title.",
    "response": {
        "code": 200,
        "body": { "result": [{ "coursesSingleEntry_title": "teach adult" }] }
    },
    "queryAST": {
        "ID": "coursesSingleEntry",
        "KIND": "courses",
        "WHERE": {},
        "OPTIONS": { "COLUMNS": ["coursesSingleEntry_title"] }
    }
}
